Vendedor,Total_Citas,Horarios,Compradores,Preferencias_Cumplidas
CAFE FINCA MI TERRON,7,08:30 - 08:45; 08:45 - 09:00; 09:00 - 09:15; 09:15 - 09:30; 09:30 - 09:45; 09:45 - 10:00; 10:00 - 10:15,PROCOLOMBIA; ARMANDO VELÁSQUEZ; REGIONAL S.A.S; BOX BRAND; CAFÉ MOLINA; FLOR A FRUTO; INTERLINK2AMERICAS,4/4
EL ORGASMO DE LOS SAINOS,5,08:30 - 08:45; 09:00 - 09:15; 09:30 - 09:45; 10:00 - 10:15; 10:15 - 10:30,REGIONAL S.A.S; COLFRESH COFFEE; CAFÉ MOLINA; PROCOLOMBIA; BOX BRAND,3/3
CAFÉ ARENILLO,5,08:30 - 08:45; 08:45 - 09:00; 09:00 - 09:15; 10:00 - 10:15; 10:15 - 10:30,INTERLINK2AMERICAS; FLOR A FRUTO; COLFRESH COFFEE; INMERSSO BOUTIQUE; BOX BRAND,5/5
SANTA CRUZ DE LAS AGUAS,3,10:00 - 10:15; 10:15 - 10:30; 10:30 - 10:45,BOX BRAND; INTERLINK2AMERICAS; FLOR A FRUTO,3/3
DON HEBER CAFÉ,5,08:30 - 08:45; 08:45 - 09:00; 09:00 - 09:15; 09:30 - 09:45; 11:15 - 11:30,REGIONAL S.A.S; ARMANDO VELÁSQUEZ; INTERLINK2AMERICAS; INMERSSO BOUTIQUE; BOX BRAND,5/5
CAFÉ TRADICIÓN NEIRA,4,08:45 - 09:00; 09:15 - 09:30; 09:30 - 09:45; 10:45 - 11:00,BOX BRAND; INMERSSO BOUTIQUE; INTERLINK2AMERICAS; ENCADENAMIENTOS PRODUCTIVOS -  CAFE AROMAS DEL EJE / CAFÉ GRANEAO.,4/4
CAFÉ OASIS DE SAMDA,3,08:30 - 08:45; 09:45 - 10:00; 10:30 - 10:45,FLOR A FRUTO; INMERSSO BOUTIQUE; ENCADENAMIENTOS PRODUCTIVOS -  CAFE AROMAS DEL EJE / CAFÉ GRANEAO.,3/3
LA PATRONA,2,09:15 - 09:30; 09:30 - 09:45,INTERLINK2AMERICAS; COLFRESH COFFEE,2/2
FINCA EL CASCABEL,5,08:30 - 08:45; 08:45 - 09:00; 09:30 - 09:45; 10:00 - 10:15; 10:15 - 10:30,ARMANDO VELÁSQUEZ; FLOR A FRUTO; BOX BRAND; INTERLINK2AMERICAS; ENCADENAMIENTOS PRODUCTIVOS -  CAFE AROMAS DEL EJE / CAFÉ GRANEAO.,5/5
CAFÉ ERMITAÑO,3,08:30 - 08:45; 09:45 - 10:00; 10:15 - 10:30,COLFRESH COFFEE; INMERSSO BOUTIQUE; FLOR A FRUTO,3/3
DELUXE COFFEE,8,08:30 - 08:45; 08:45 - 09:00; 09:00 - 09:15; 09:15 - 09:30; 09:30 - 09:45; 09:45 - 10:00; 10:15 - 10:30; 10:30 - 10:45,REGIONAL S.A.S; CAFÉ MOLINA; BOX BRAND; INMERSSO BOUTIQUE; COLFRESH COFFEE; FLOR A FRUTO; ARMANDO VELÁSQUEZ; INTERLINK2AMERICAS,8/8
RUNA COFFEE,8,08:30 - 08:45; 08:45 - 09:00; 09:15 - 09:30; 09:45 - 10:00; 10:00 - 10:15; 10:15 - 10:30; 10:30 - 10:45; 10:45 - 11:00,FLOR A FRUTO; INMERSSO BOUTIQUE; BOX BRAND; CAFÉ MOLINA; COLFRESH COFFEE; NEIRA YORK COFFEE; ENCADENAMIENTOS PRODUCTIVOS -  CAFE AROMAS DEL EJE / CAFÉ GRANEAO.; ARMANDO VELÁSQUEZ,8/8
CAFE GRANEAO,1,10:15 - 10:30,INTERLINK2AMERICAS,1/1
CAFÉ VALLE DE LIRIO,10,08:30 - 08:45; 08:45 - 09:00; 09:00 - 09:15; 09:15 - 09:30; 09:30 - 09:45; 09:45 - 10:00; 10:00 - 10:15; 10:15 - 10:30; 10:45 - 11:00; 11:00 - 11:15,CAFÉ MOLINA; COLFRESH COFFEE; REGIONAL S.A.S; FLOR A FRUTO; BOX BRAND; INMERSSO BOUTIQUE; PROCOLOMBIA; INTERLINK2AMERICAS; ARMANDO VELÁSQUEZ; NEIRA YORK COFFEE,10/10
CAFÉ GRANADA,3,08:30 - 08:45; 08:45 - 09:00; 10:00 - 10:15,INMERSSO BOUTIQUE; INTERLINK2AMERICAS; BOX BRAND,3/3
CAFÉ MATILDE 1960,6,08:30 - 08:45; 08:45 - 09:00; 10:00 - 10:15; 10:15 - 10:30; 10:30 - 10:45; 11:30 - 11:45,COLFRESH COFFEE; REGIONAL S.A.S; BOX BRAND; ARMANDO VELÁSQUEZ; INTERLINK2AMERICAS; INMERSSO BOUTIQUE,6/7
CINCO DAMAS,3,08:30 - 08:45; 08:45 - 09:00; 10:30 - 10:45,ARMANDO VELÁSQUEZ; INMERSSO BOUTIQUE; NEIRA YORK COFFEE,3/3
FINCA LA RIVERA,9,08:30 - 08:45; 09:00 - 09:15; 09:15 - 09:30; 09:30 - 09:45; 09:45 - 10:00; 10:00 - 10:15; 10:15 - 10:30; 10:30 - 10:45; 11:45 - 12:00,PROCOLOMBIA; INMERSSO BOUTIQUE; REGIONAL S.A.S; BOX BRAND; CAFÉ MOLINA; COLFRESH COFFEE; FLOR A FRUTO; NEIRA YORK COFFEE; INTERLINK2AMERICAS,9/9
CAFE MIS TAITAS,1,09:15 - 09:30,INTERLINK2AMERICAS,1/1
CAFÉ CAMPOHERMOSO,2,08:30 - 08:45; 10:45 - 11:00,FLOR A FRUTO; NEIRA YORK COFFEE,2/2
CAFÉ MURAL,5,08:45 - 09:00; 09:00 - 09:15; 09:30 - 09:45; 09:45 - 10:00; 11:00 - 11:15,BOX BRAND; INTERLINK2AMERICAS; INMERSSO BOUTIQUE; COLFRESH COFFEE; NEIRA YORK COFFEE,5/5
FINCA LA FEDERICA,7,08:45 - 09:00; 09:00 - 09:15; 09:15 - 09:30; 09:30 - 09:45; 09:45 - 10:00; 10:30 - 10:45; 10:45 - 11:00,REGIONAL S.A.S; CAFÉ MOLINA; INMERSSO BOUTIQUE; ARMANDO VELÁSQUEZ; COLFRESH COFFEE; INTERLINK2AMERICAS; ENCADENAMIENTOS PRODUCTIVOS -  CAFE AROMAS DEL EJE / CAFÉ GRANEAO.,7/7
D'CLEO COFFEE,3,08:30 - 08:45; 09:30 - 09:45; 12:00 - 12:15,BOX BRAND; INTERLINK2AMERICAS; PROCOLOMBIA,3/3
CAFÉ ORIGEN DE LA MONTAÑA,4,11:15 - 11:30; 11:30 - 11:45; 11:45 - 12:00; 12:00 - 12:15,BOX BRAND; INMERSSO BOUTIQUE; INTERLINK2AMERICAS; PROCOLOMBIA,4/4
SIETE LEONES CAFÉ,3,09:15 - 09:30; 09:45 - 10:00; 10:00 - 10:15,INTERLINK2AMERICAS; BOX BRAND; INMERSSO BOUTIQUE,3/3
CAFE ARTE,2,08:30 - 08:45; 09:30 - 09:45,PROCOLOMBIA; INTERLINK2AMERICAS,2/2
CAFÉ AGUA VIVA,10,08:30 - 08:45; 08:45 - 09:00; 09:00 - 09:15; 09:15 - 09:30; 09:45 - 10:00; 10:00 - 10:15; 10:15 - 10:30; 11:00 - 11:15; 11:15 - 11:30; 11:30 - 11:45,INTERLINK2AMERICAS; COLFRESH COFFEE; CAFÉ MOLINA; REGIONAL S.A.S; FLOR A FRUTO; INMERSSO BOUTIQUE; ARMANDO VELÁSQUEZ; ENCADENAMIENTOS PRODUCTIVOS -  CAFE AROMAS DEL EJE / CAFÉ GRANEAO.; BOX BRAND; NEIRA YORK COFFEE,10/10
LADERAS DEL TAPIAS,4,08:30 - 08:45; 09:00 - 09:15; 09:30 - 09:45; 11:45 - 12:00,ARMANDO VELÁSQUEZ; BOX BRAND; INMERSSO BOUTIQUE; INTERLINK2AMERICAS,4/4
VILLA CLARA IMPORTACIONES Y EXPORTACIONES SAS,4,08:45 - 09:00; 09:30 - 09:45; 09:45 - 10:00; 11:00 - 11:15,INTERLINK2AMERICAS; REGIONAL S.A.S; BOX BRAND; ENCADENAMIENTOS PRODUCTIVOS -  CAFE AROMAS DEL EJE / CAFÉ GRANEAO.,4/4
DE SOL A SOL,5,08:30 - 08:45; 09:00 - 09:15; 09:15 - 09:30; 09:30 - 09:45; 11:30 - 11:45,CAFÉ MOLINA; COLFRESH COFFEE; FLOR A FRUTO; ARMANDO VELÁSQUEZ; NEIRA YORK COFFEE,5/5
ROJO PASIÓN,7,08:45 - 09:00; 09:00 - 09:15; 09:30 - 09:45; 09:45 - 10:00; 10:15 - 10:30; 10:30 - 10:45; 10:45 - 11:00,CAFÉ MOLINA; INMERSSO BOUTIQUE; REGIONAL S.A.S; BOX BRAND; ENCADENAMIENTOS PRODUCTIVOS -  CAFE AROMAS DEL EJE / CAFÉ GRANEAO.; FLOR A FRUTO; NEIRA YORK COFFEE,7/7
CAFÉ LA AVANZANTE,2,08:30 - 08:45; 10:15 - 10:30,INMERSSO BOUTIQUE; NEIRA YORK COFFEE,2/2
